{
  "Type" : "BSP",
  "Document" : "BSP00281",
  "Projet" : "0936",
  "Activite" : "20830",
  "Transaction1Quantite" : "76",
  "PrixUnitaireTransaction1" : "79",
  "Statut" : "SUS",
  "DescriptionLigne" : "S-22284 FB 1/2\" x 20' a faire chanfrein de 1/2\" avec meplat de 1/8\" sur un c\u00F4t\u00E9 seulement",
  "Compagnie" : "001",
  "Ordre" : "1"
}