[
  {
    "Type": "BSP",
    "Document": "BSP1",
    "Ligne": "1",
    "Projet": "0867",
    "Activite": "10010",
    "Extra": "",
    "Equipement": "",
    "CategorieCout": "2",
    "TravauxCours": "N",
    "Division": "001",
    "Item": "",
    "Version": "",
    "Entrepot": "",
    "Transaction1Serie": "",
    "Transaction1Quantite": "2",
    "Transaction1Unite": "PND",
    "Transaction2Quantite": "",
    "Transaction2Unite": "",
    "PrixUnitaireTransaction1": "0.85",
    "EscompteTransaction1": "",
    "SousTotalApresEscompteTransaction1": "",
    "Taxe1Transaction1": "",
    "Taxe2Transaction1": "",
    "GrandTotalTransaction1": "2107.184",
    "PrixUnitaireTransaction2": "",
    "EscompteTransaction2": "",
    "SousTotalApresEscompteTransaction2": "",
    "Taxe1Transaction2": "0",
    "Taxe2Transaction2": "0",
    "GrandTotalTransaction2": "0",
    "Statut": "ACT",
    "QuantiteSuspend": "2560",
    "CodeTaxe1": "TF",
    "CodeTaxe2": "TP",
    "DescriptionLigne": "L2X2X3/16 44W X6096 mm",
    "MontantRetenuetaxesApresRetenueTransaction2": "0",
    "MontantRetenuetaxesApresRetenueTransaction1": "0",
    "NoPiece": "",
    "QuantiteDejaTraitee": "0",
    "QuantiteAnnulee": "0",
    "MontantDejaTraite": "0",
    "MontantSuspens": "",
    "MontantAnnule": "0",
    "DateLivraison": "",
    "PourcentageRetenuetaxesApresRetenueTransaction1": "0",
    "PourcentageRetenuetaxesAvantRetenueTransaction1": "0",
    "MontantRetenuetaxesAvantRetenueTransaction1": "0",
    "PourcentageRetenuetaxesApresRetenueTransaction2": "0",
    "PourcentageRetenuetaxesAvantRetenueTransaction2": "0",
    "MontantRetenuetaxesAvantRetenueTransaction2": "0",
    "PourcentageEscompteTransaction1": "0",
    "PourcentageEscompteTransaction2": "0",
    "SousTotalAvantAjustementTransaction1": "",
    "SousTotalAvantAjustementTransaction2": "",
    "Reference1": "",
    "Reference2": "",
    "Reference3": "",
    "CodeTaxe1Transaction2": "TF",
    "CodeTaxe2Transaction2": "TP",
    "Transaction1QuantiteMaitre": "0",
    "Transaction1MontantMaitre": "0",
    "QuantiteDejaTraiteeMaitre": "0",
    "MontantDejaTraiteMaitre": "0",
    "QuantiteSuspendMaitre": "0",
    "MontantSuspendMaitre": "0",
    "QuantiteAnnuleeMaitre": "0",
    "MontantAnnuleMaitre": "0",
    "Compagnie": "001",
    "Ordre": "1",
    "LigneGeneree": "N",
    "DossierPatient": "",
    "Commentaire": "",
    "Transaction2Serie": "",
    "SerieTraites": "",
    "MontantArrondiAjustement": "0",
    "MontantArrondiRetenuetaxesApresRetenue": "0",
    "MontantArrondiRetenuetaxesAvantRetenue": "0",
    "Modalite": "",
    "NumeroDepot": "",
    "LigneDocumentMaitre": "0",
    "NumeroFactureAvance": "",
    "FrequenceInitialeDescription": "",
    "FrequenceInitialeQuantite": "0",
    "FrequenceInitialeUnite": "",
    "FrequenceInitialePrixUnitaire": "0",
    "FrequenceInitialePeriode": "0",
    "FrequenceInitialeFrequence": "H",
    "FrequencePeriodiqueDescription": "",
    "FrequencePeriodiqueQuantite": "0",
    "FrequencePeriodiqueUnite": "",
    "FrequencePeriodiquePrixUnitaire": "0",
    "FrequencePeriodiquePeriode": "0",
    "FrequencePeriodiqueFrequence": "H",
    "FrequencePeriodiqueNombre": "0",
    "FrequenceFinaleDescription": "",
    "FrequenceFinaleQuantite": "0",
    "FrequenceFinaleUnite": "UNI",
    "FrequenceFinalePrixUnitaire": "0",
    "FrequenceMaximumQuantite": "0",
    "FrequenceMaximumUnite": "UNI",
    "FrequenceMaximumMontant": "0",
    "FrequenceInititaleDateDebut": "",
    "FrequencePeriodiqueDateDebut": "",
    "DateDebutFrequence": "",
    "DateFinFrequence": "",
    "GestionQuantites": "M",
    "MontantRetenueretenueApresTaxesTransaction1": "0",
    "MontantRetenueretenueApresTaxesTransaction2": "0",
    "PourcentageRetenueRetenueApresTaxesTransaction1": "0",
    "PourcentageRetenueRetenueApresTaxesTransaction2": "0",
    "MontantArrondiRetenueretenueApresTaxes": "0",
    "IdentifiantUnique": "",
    "FrequenceInitialeDefautDocumentProduitDescription": "",
    "FrequenceInitialeDefautDocumentProduitQuantite": "0",
    "FrequenceInitialeDefautDocumentProduitUnite": "UNI",
    "FrequenceInitialeDefautDocumentProduitPrixUnitaire": "0",
    "FrequenceInitialeDefautDocumentProduitPeriode": "0",
    "FrequenceInitialeDefautDocumentProduitFrequence": "H",
    "FrequencePeriodiqueDefautDocumentProduitDescription": "",
    "FrequencePeriodiqueDefautDocumentProduitQuantite": "0",
    "FrequencePeriodiqueDefautDocumentProduitUnite": "UNI",
    "FrequencePeriodiqueDefautDocumentProduitPrixUnitair": "0",
    "FrequencePeriodiqueDefautDocumentProduitPeriode": "0",
    "FrequencePeriodiqueDefautDocumentProduitFrequence": "H",
    "FrequencePeriodiqueDefautDocumentProduitNombre": "0",
    "FrequenceFinaleDefautDocumentProduitDescription": "",
    "FrequenceFinaleDefautDocumentProduitQuantite": "0",
    "FrequenceFinaleDefautDocumentProduitUnite": "UNI",
    "FrequenceFinaleDefautDocumentProduitPrixUnitaire": "0",
    "FrequenceModalite": "",
    "CTITaxe1Transaction1": "",
    "CTITaxe2Transaction1": "",
    "CTITaxe1Transaction2": "0",
    "CTITaxe2Transaction2": "0",
    "LigneItemMaitreListeMateriel": "0",
    "CodeCatalogue": "",
    "CodeFabricant": "",
    "PieceFabricant": "",
    "TransactionSousTraitance": "N",
    "VersionRecord": "",
    "TimestampDerniereSauvegarde": "2022-06-07 hh:mm:ss",
    "TypeDocumentMaitre": "",
    "DocumentMaitre": "",
    "Majoration1Transaction1": "0",
    "Majoration2Transaction1": "0",
    "Majoration1Transaction2": "0",
    "Majoration2Transaction2": "0",
    "PourcMajoration1Transaction1": "0",
    "PourcMajoration2Transaction1": "0",
    "PourcMajoration1Transaction2": "0",
    "PourcMajoration2Transaction2": "0",
    "NiveauApplicationMajoration1": "1",
    "NiveauApplicationMajoration2": "1",
    "CategorieVendant": "2",
    "VentilationMaitre": "0",
    "PourcentageAvancement": "0",
    "PourcentageAvancementLivraison": "0",
    "TypeVentilation": "A"
  }
]